{"$id":"https://moving-origin-research.invalid/schemas/m4-model-ladder-manifest-v1","$schema":"https://json-schema.org/draft/2020-12/schema","additionalProperties":false,"properties":{"date":{"const":"2026-08-21"},"prohibited_model_ids":{"items":{"type":"string"},"minItems":2,"type":"array","uniqueItems":true},"regime":{"const":"B"},"rungs":{"items":{"additionalProperties":false,"properties":{"allow_files":{"items":{"additionalProperties":false,"properties":{"bytes":{"minimum":1,"type":"integer"},"class":{"enum":["WEIGHT","TOKENIZER","CONFIG","LICENSE","DOCUMENTATION","GIT_METADATA"]},"name":{"type":"string"},"sha256":{"anyOf":[{"pattern":"^[0-9a-f]{64}$"},{"type":"null"}]}},"required":["name","bytes","class","sha256"],"type":"object"},"minItems":1,"type":"array"},"license_id":{"const":"Apache-2.0"},"license_url":{"format":"uri"},"ordinal":{"enum":[0,1]},"publisher_class":{"const":"OFFICIAL_QWEN_FP8"},"repository_id":{"type":"string"},"revision":{"pattern":"^[0-9a-f]{40}$"},"rung_id":{"enum":["PRIMARY_QWEN3_4B_FP8","FALLBACK_QWEN3_8B_FP8"]},"runtime":{"additionalProperties":false,"properties":{"decoding":{"type":"object"},"enable_thinking":{"const":false},"max_model_len":{"const":8192},"max_num_seqs":{"const":1},"quantization":{"const":"fp8"}},"required":["max_model_len","max_num_seqs","quantization","enable_thinking","decoding"],"type":"object"},"weight_files":{"items":{"additionalProperties":false,"properties":{"bytes":{"minimum":1,"type":"integer"},"name":{"pattern":"\\.safetensors$"},"sha256":{"pattern":"^[0-9a-f]{64}$"}},"required":["name","bytes","sha256"],"type":"object"},"minItems":1,"type":"array"}},"required":["ordinal","rung_id","repository_id","revision","publisher_class","license_id","license_url","allow_files","weight_files","runtime"],"type":"object"},"maxItems":2,"minItems":2,"type":"array"},"schema_version":{"const":"m4-model-ladder-manifest-v1"},"serving_stack":{"additionalProperties":false,"properties":{"image":{"const":"docker.io/vllm/vllm-openai"},"index_digest":{"pattern":"^sha256:[0-9a-f]{64}$"},"linux_amd64_digest":{"pattern":"^sha256:[0-9a-f]{64}$"},"tag":{"const":"v0.10.2"}},"required":["image","tag","index_digest","linux_amd64_digest"],"type":"object"},"source_class":{"const":"PROPOSED"}},"required":["schema_version","date","regime","source_class","serving_stack","rungs","prohibited_model_ids"],"title":"M4 model ladder manifest v1","type":"object","x-artifact-date":"2026-08-21","x-artifact-regime":"B","x-source-class":"PROPOSED"}
