{"schema_version":"m4-model-ladder-manifest-v1","date":"2026-08-21","regime":"B","source_class":"PROPOSED","serving_stack":{"image":"docker.io/vllm/vllm-openai","tag":"v0.10.2","index_digest":"sha256:607442e407b0fea97f8a132a78b787c121a996dd4de181fa08e8da06e71ec2db","linux_amd64_digest":"sha256:df2607b26bdda2875de4832f4d08da0055b4b6e3570347f3a849bcc652771dd6"},"rungs":[{"ordinal":0,"rung_id":"PRIMARY_QWEN3_4B_FP8","repository_id":"Qwen/Qwen3-4B-Instruct-2507-FP8","revision":"8591804019c8b22094c3b5b4454e0edc05dffc98","publisher_class":"OFFICIAL_QWEN_FP8","license_id":"Apache-2.0","license_url":"https://huggingface.co/Qwen/Qwen3-4B-Instruct-2507-FP8/blob/8591804019c8b22094c3b5b4454e0edc05dffc98/LICENSE","allow_files":[{"name":".gitattributes","bytes":1570,"class":"GIT_METADATA","sha256":null},{"name":"LICENSE","bytes":11343,"class":"LICENSE","sha256":null},{"name":"README.md","bytes":8755,"class":"DOCUMENTATION","sha256":null},{"name":"config.json","bytes":4210,"class":"CONFIG","sha256":null},{"name":"generation_config.json","bytes":239,"class":"CONFIG","sha256":null},{"name":"merges.txt","bytes":1671853,"class":"TOKENIZER","sha256":null},{"name":"model.safetensors","bytes":5190053264,"class":"WEIGHT","sha256":"b6154d74332140fd6dfbfbe70bbb3650dd6955861132bd59dda6789e6322b485"},{"name":"tokenizer.json","bytes":11422654,"class":"TOKENIZER","sha256":"aeb13307a71acd8fe81861d94ad54ab689df773318809eed3cbe794b4492dae4"},{"name":"tokenizer_config.json","bytes":9377,"class":"TOKENIZER","sha256":null},{"name":"vocab.json","bytes":2776833,"class":"TOKENIZER","sha256":null}],"weight_files":[{"name":"model.safetensors","bytes":5190053264,"sha256":"b6154d74332140fd6dfbfbe70bbb3650dd6955861132bd59dda6789e6322b485"}],"runtime":{"max_model_len":8192,"max_num_seqs":1,"quantization":"fp8","enable_thinking":false,"decoding":{"temperature":0,"top_p":1,"top_k":-1,"n":1,"max_new_tokens":512,"presence_penalty":0,"frequency_penalty":0}}},{"ordinal":1,"rung_id":"FALLBACK_QWEN3_8B_FP8","repository_id":"Qwen/Qwen3-8B-FP8","revision":"220b46e3b2180893580a4454f21f22d3ebb187d3","publisher_class":"OFFICIAL_QWEN_FP8","license_id":"Apache-2.0","license_url":"https://huggingface.co/Qwen/Qwen3-8B-FP8/blob/220b46e3b2180893580a4454f21f22d3ebb187d3/LICENSE","allow_files":[{"name":".gitattributes","bytes":1570,"class":"GIT_METADATA","sha256":null},{"name":"LICENSE","bytes":11343,"class":"LICENSE","sha256":null},{"name":"README.md","bytes":17487,"class":"DOCUMENTATION","sha256":null},{"name":"config.json","bytes":896,"class":"CONFIG","sha256":null},{"name":"generation_config.json","bytes":213,"class":"CONFIG","sha256":null},{"name":"merges.txt","bytes":1671853,"class":"TOKENIZER","sha256":null},{"name":"model-00001-of-00002.safetensors","bytes":4953240624,"class":"WEIGHT","sha256":"83bb444edc7d4a1ed91ab67ad19620e2ed74724cdd62ede330fcaa7748c64404"},{"name":"model-00002-of-00002.safetensors","bytes":4483388160,"class":"WEIGHT","sha256":"c59d27856ca358b24770802ea52f1785258830f61ff3ac72a4b3896fad648f9b"},{"name":"model.safetensors.index.json","bytes":55847,"class":"CONFIG","sha256":null},{"name":"tokenizer.json","bytes":11422654,"class":"TOKENIZER","sha256":"aeb13307a71acd8fe81861d94ad54ab689df773318809eed3cbe794b4492dae4"},{"name":"tokenizer_config.json","bytes":9732,"class":"TOKENIZER","sha256":null},{"name":"vocab.json","bytes":2776833,"class":"TOKENIZER","sha256":null}],"weight_files":[{"name":"model-00001-of-00002.safetensors","bytes":4953240624,"sha256":"83bb444edc7d4a1ed91ab67ad19620e2ed74724cdd62ede330fcaa7748c64404"},{"name":"model-00002-of-00002.safetensors","bytes":4483388160,"sha256":"c59d27856ca358b24770802ea52f1785258830f61ff3ac72a4b3896fad648f9b"}],"runtime":{"max_model_len":8192,"max_num_seqs":1,"quantization":"fp8","enable_thinking":false,"decoding":{"temperature":0,"top_p":1,"top_k":-1,"n":1,"max_new_tokens":512,"presence_penalty":0,"frequency_penalty":0}}}],"prohibited_model_ids":["RedHatAI/Llama-3.2-3B-Instruct-FP8","RedHatAI/Llama-3.2-3B-Instruct-FP8-dynamic","nvidia/Llama-3.1-8B-Instruct-FP8"]}
